{
  "notes": [],
  "outcome": "candidate",
  "proposals": [
    {
      "anchor": { "kind": "function" },
      "comment": "// cs: ai requires value > 0",
      "evidence": ["Candidate branch assumption."],
      "machine_proposed": true,
      "rationale": "Positive input proposal."
    },
    {
      "anchor": { "kind": "function" },
      "comment": "// cs: ai requires value <= 0",
      "evidence": ["Candidate branch assumption."],
      "machine_proposed": true,
      "rationale": "Non-positive input proposal."
    }
  ],
  "request_id": "sha256:c5b6437b8d9bc77ba79d7a71692ef04577b5c07dcdacdafd54598990b6e091bc",
  "schema": "codeskeptic.contract-proposal-response/v1"
}