{
  "notes": [],
  "outcome": "candidate",
  "proposals": [
    {
      "anchor": { "kind": "function" },
      "comment": "// cs: ai ensures result >= 0",
      "evidence": ["Both assignment arms produce a non-negative result."],
      "machine_proposed": true,
      "rationale": "The returned local is clamped at zero."
    }
  ],
  "request_id": "sha256:c5b6437b8d9bc77ba79d7a71692ef04577b5c07dcdacdafd54598990b6e091bc",
  "schema": "codeskeptic.contract-proposal-response/v1"
}